{
  "$schema": "../schema.json",
  "tool_id": "node",
  "host": "windows-x64",
  "version": "22.15.0",
  "url": "https://nodejs.org/download/release/v22.15.0/node-v22.15.0-win-x64.zip",
  "sha256": "06067d4f0d463f90ed803d5eca5b039a05dec5d70fc7b7cc254803a59bd0e27c",
  "archive_type": "zip",
  "destination": "tools/runtime/windows-x64/node",
  "executables": ["node.exe"],
  "license_files": ["LICENSE"],
  "component_kind": "runtime",
  "required_for_launch": true,
  "required_for_build": false,
  "archive_subdir": "node-v22.15.0-win-x64"
}
