{
  "$schema": "../schema.json",
  "tool_id": "perl",
  "host": "macos-arm64",
  "version": "manual",
  "url": "https://www.perl.org/get.html",
  "sha256": "",
  "archive_type": "tar.gz",
  "destination": "tools/runtime/macos-arm64/perl",
  "executables": ["bin/perl"],
  "license_files": ["Artistic"],
  "component_kind": "runtime",
  "required_for_launch": true,
  "required_for_build": false,
  "install_enabled": false,
  "install_hint": "macOS Perl still needs a portable repo-local distribution before it can join automated bootstrap."
}
