{
  "$schema": "../schema.json",
  "tool_id": "python",
  "host": "macos-arm64",
  "version": "manual",
  "url": "https://www.python.org/downloads/macos/",
  "sha256": "",
  "archive_type": "zip",
  "destination": "tools/runtime/macos-arm64/python",
  "executables": ["bin/python3"],
  "license_files": ["LICENSE.txt"],
  "component_kind": "runtime",
  "required_for_launch": true,
  "required_for_build": false,
  "install_enabled": false,
  "install_hint": "macOS Python still needs a repo-local portable bundle that can be staged inside tools/runtime/macos-arm64/python."
}
