{
  "$schema": "../schema.json",
  "tool_id": "jdk",
  "host": "macos-arm64",
  "version": "21.0.7+6",
  "url": "https://github.com/adoptium/temurin21-binaries/releases/download/jdk-21.0.7%2B6/OpenJDK21U-jdk_aarch64_mac_hotspot_21.0.7_6.tar.gz",
  "sha256": "",
  "archive_type": "tar.gz",
  "destination": "tools/runtime/macos-arm64/java",
  "executables": ["bin/java", "bin/javac", "bin/jar", "bin/jpackage"],
  "license_files": ["legal"],
  "component_kind": "runtime",
  "required_for_launch": true,
  "required_for_build": true,
  "archive_subdir": "jdk-21.0.7+6/Contents/Home",
  "install_hint": "macOS JDK bootstrap is pinned here and should be validated on a macOS arm64 host."
}
